=============================================================
                STRATEGY: FIRST_FIT
=============================================================

MEMORY_SIZE: 1000
STRATEGY: FIRST_FIT
ALLOCATE: P1 100
RESULT: SUCCESS
BLOCK: P1 [0-99] SIZE:100
ALLOCATE: P2 200
RESULT: SUCCESS
BLOCK: P2 [100-299] SIZE:200
ALLOCATE: P3 150
RESULT: SUCCESS
BLOCK: P3 [300-449] SIZE:150
STATUS:
MEMORY_BLOCKS: 4
BLOCK: P1 [0-99] SIZE:100 STATE:ALLOCATED
BLOCK: P2 [100-299] SIZE:200 STATE:ALLOCATED
BLOCK: P3 [300-449] SIZE:150 STATE:ALLOCATED
BLOCK: FREE [450-999] SIZE:550 STATE:FREE
TOTAL_FREE: 550
TOTAL_ALLOCATED: 450
FRAGMENTATION: 0.00
TERMINATE: P2
RESULT: SUCCESS
COALESCING: 0 blocks merged

STATUS:
MEMORY_BLOCKS: 4
BLOCK: P1 [0-99] SIZE:100 STATE:ALLOCATED
BLOCK: FREE [100-299] SIZE:200 STATE:FREE
BLOCK: P3 [300-449] SIZE:150 STATE:ALLOCATED
BLOCK: FREE [450-999] SIZE:550 STATE:FREE
TOTAL_FREE: 750
TOTAL_ALLOCATED: 250
FRAGMENTATION: 26.67
ALLOCATE: P4 180
RESULT: SUCCESS
BLOCK: P4 [100-279] SIZE:180
STATUS:
MEMORY_BLOCKS: 5
BLOCK: P1 [0-99] SIZE:100 STATE:ALLOCATED
BLOCK: P4 [100-279] SIZE:180 STATE:ALLOCATED
BLOCK: FREE [280-299] SIZE:20 STATE:FREE
BLOCK: P3 [300-449] SIZE:150 STATE:ALLOCATED
BLOCK: FREE [450-999] SIZE:550 STATE:FREE
TOTAL_FREE: 570
TOTAL_ALLOCATED: 430
FRAGMENTATION: 3.51
TERMINATE: P1
RESULT: SUCCESS
COALESCING: 0 blocks merged

TERMINATE: P3
RESULT: SUCCESS
COALESCING: 2 blocks merged
MERGED_BLOCK: [280-999] SIZE:720

STATUS:
MEMORY_BLOCKS: 3
BLOCK: FREE [0-99] SIZE:100 STATE:FREE
BLOCK: P4 [100-279] SIZE:180 STATE:ALLOCATED
BLOCK: FREE [280-999] SIZE:720 STATE:FREE
TOTAL_FREE: 820
TOTAL_ALLOCATED: 180
FRAGMENTATION: 12.20


=============================================================
                STRATEGY: BEST_FIT
=============================================================

MEMORY_SIZE: 1000
STRATEGY: BEST_FIT
ALLOCATE: P1 100
RESULT: SUCCESS
BLOCK: P1 [0-99] SIZE:100
ALLOCATE: P2 200
RESULT: SUCCESS
BLOCK: P2 [100-299] SIZE:200
ALLOCATE: P3 150
RESULT: SUCCESS
BLOCK: P3 [300-449] SIZE:150
STATUS:
MEMORY_BLOCKS: 4
BLOCK: P1 [0-99] SIZE:100 STATE:ALLOCATED
BLOCK: P2 [100-299] SIZE:200 STATE:ALLOCATED
BLOCK: P3 [300-449] SIZE:150 STATE:ALLOCATED
BLOCK: FREE [450-999] SIZE:550 STATE:FREE
TOTAL_FREE: 550
TOTAL_ALLOCATED: 450
FRAGMENTATION: 0.00
TERMINATE: P2
RESULT: SUCCESS
COALESCING: 0 blocks merged

STATUS:
MEMORY_BLOCKS: 4
BLOCK: P1 [0-99] SIZE:100 STATE:ALLOCATED
BLOCK: FREE [100-299] SIZE:200 STATE:FREE
BLOCK: P3 [300-449] SIZE:150 STATE:ALLOCATED
BLOCK: FREE [450-999] SIZE:550 STATE:FREE
TOTAL_FREE: 750
TOTAL_ALLOCATED: 250
FRAGMENTATION: 26.67
ALLOCATE: P4 180
RESULT: SUCCESS
BLOCK: P4 [100-279] SIZE:180
STATUS:
MEMORY_BLOCKS: 5
BLOCK: P1 [0-99] SIZE:100 STATE:ALLOCATED
BLOCK: P4 [100-279] SIZE:180 STATE:ALLOCATED
BLOCK: FREE [280-299] SIZE:20 STATE:FREE
BLOCK: P3 [300-449] SIZE:150 STATE:ALLOCATED
BLOCK: FREE [450-999] SIZE:550 STATE:FREE
TOTAL_FREE: 570
TOTAL_ALLOCATED: 430
FRAGMENTATION: 3.51
TERMINATE: P1
RESULT: SUCCESS
COALESCING: 0 blocks merged

TERMINATE: P3
RESULT: SUCCESS
COALESCING: 2 blocks merged
MERGED_BLOCK: [280-999] SIZE:720

STATUS:
MEMORY_BLOCKS: 3
BLOCK: FREE [0-99] SIZE:100 STATE:FREE
BLOCK: P4 [100-279] SIZE:180 STATE:ALLOCATED
BLOCK: FREE [280-999] SIZE:720 STATE:FREE
TOTAL_FREE: 820
TOTAL_ALLOCATED: 180
FRAGMENTATION: 12.20


=============================================================
                STRATEGY: WORST_FIT
=============================================================

MEMORY_SIZE: 1000
STRATEGY: WORST_FIT
ALLOCATE: P1 100
RESULT: SUCCESS
BLOCK: P1 [0-99] SIZE:100
ALLOCATE: P2 200
RESULT: SUCCESS
BLOCK: P2 [100-299] SIZE:200
ALLOCATE: P3 150
RESULT: SUCCESS
BLOCK: P3 [300-449] SIZE:150
STATUS:
MEMORY_BLOCKS: 4
BLOCK: P1 [0-99] SIZE:100 STATE:ALLOCATED
BLOCK: P2 [100-299] SIZE:200 STATE:ALLOCATED
BLOCK: P3 [300-449] SIZE:150 STATE:ALLOCATED
BLOCK: FREE [450-999] SIZE:550 STATE:FREE
TOTAL_FREE: 550
TOTAL_ALLOCATED: 450
FRAGMENTATION: 0.00
TERMINATE: P2
RESULT: SUCCESS
COALESCING: 0 blocks merged

STATUS:
MEMORY_BLOCKS: 4
BLOCK: P1 [0-99] SIZE:100 STATE:ALLOCATED
BLOCK: FREE [100-299] SIZE:200 STATE:FREE
BLOCK: P3 [300-449] SIZE:150 STATE:ALLOCATED
BLOCK: FREE [450-999] SIZE:550 STATE:FREE
TOTAL_FREE: 750
TOTAL_ALLOCATED: 250
FRAGMENTATION: 26.67
ALLOCATE: P4 180
RESULT: SUCCESS
BLOCK: P4 [450-629] SIZE:180
STATUS:
MEMORY_BLOCKS: 5
BLOCK: P1 [0-99] SIZE:100 STATE:ALLOCATED
BLOCK: FREE [100-299] SIZE:200 STATE:FREE
BLOCK: P3 [300-449] SIZE:150 STATE:ALLOCATED
BLOCK: P4 [450-629] SIZE:180 STATE:ALLOCATED
BLOCK: FREE [630-999] SIZE:370 STATE:FREE
TOTAL_FREE: 570
TOTAL_ALLOCATED: 430
FRAGMENTATION: 35.09
TERMINATE: P1
RESULT: SUCCESS
COALESCING: 1 blocks merged
MERGED_BLOCK: [0-299] SIZE:300

TERMINATE: P3
RESULT: SUCCESS
COALESCING: 1 blocks merged
MERGED_BLOCK: [0-449] SIZE:450

STATUS:
MEMORY_BLOCKS: 3
BLOCK: FREE [0-449] SIZE:450 STATE:FREE
BLOCK: P4 [450-629] SIZE:180 STATE:ALLOCATED
BLOCK: FREE [630-999] SIZE:370 STATE:FREE
TOTAL_FREE: 820
TOTAL_ALLOCATED: 180
FRAGMENTATION: 45.12